{
  "authenticationMethod": "example_value",
  "email": "user@example.com",
  "userName": "example_value",
  "clientUserId": "500123",
  "recipientId": "500123",
  "returnUrl": "https://www.example.com",
  "pingUrl": "https://www.example.com",
  "pingFrequency": "example_value",
  "frameAncestors": [],
  "messageOrigins": [],
  "securityDomain": "example_value"
}